
[
  {
    "sku": "AUC00202500",
    "name": "Modular Changeover Switch 25A Double Pole",
    "product_family": "Tripper",
    "category": "Circuit Protection",
    "subcategory": "Modular Changeover Switches",
    "specs": {
      "ampere": 25,
      "poles": 2,
      "mw": 2
    },
    "variant": [],
    "pricing": {
      "mrp": 1795,
      "discount": null,
      "selling_price": null,
      "std_pack": "1/1"
    },
    "media": {
      "images": [],
      "documents": []
    },
    "seo": {
      "slug": "modular-changeover-switch-25a-double-pole",
      "keywords": [
        "Modular Changeover Switch",
        "Changeover",
        "25A",
        "Double Pole",
        "AUC00202500",
        "New Delhi Electricals",
        "Electrical Products"
      ],
      "meta_description": "Buy 25A Double Pole Modular Changeover Switch (AUC00202500) from New Delhi Electricals. Premium quality modular changeover for reliable power switching."
    },
    "status": {
      "is_active": true,
      "is_featured": false
    },
    "brand": "Lauritz Knudsen"
  },
  {
    "sku": "AUC00204000",
    "name": "Modular Changeover Switch 40A Double Pole",
    "product_family": "Tripper",
    "category": "Circuit Protection",
    "subcategory": "Modular Changeover Switches",
    "specs": {
      "ampere": 40,
      "poles": 2,
      "mw": 2
    },
    "variant": [],
    "pricing": {
      "mrp": 2745,
      "discount": null,
      "selling_price": null,
      "std_pack": "1/1"
    },
    "media": {
      "images": [],
      "documents": []
    },
    "seo": {
      "slug": "modular-changeover-switch-40a-double-pole",
      "keywords": [
        "Modular Changeover Switch",
        "Changeover",
        "40A",
        "Double Pole",
        "AUC00204000",
        "New Delhi Electricals",
        "Electrical Products"
      ],
      "meta_description": "Buy 40A Double Pole Modular Changeover Switch (AUC00204000) from New Delhi Electricals. Premium quality modular changeover for reliable power switching."
    },
    "status": {
      "is_active": true,
      "is_featured": false
    },
    "brand": "Lauritz Knudsen"
  },
  {
    "sku": "AUC00206300",
    "name": "Modular Changeover Switch 63A Double Pole",
    "product_family": "Tripper",
    "category": "Circuit Protection",
    "subcategory": "Modular Changeover Switches",
    "specs": {
      "ampere": 63,
      "poles": 2,
      "mw": 3
    },
    "variant": [],
    "pricing": {
      "mrp": 3195,
      "discount": null,
      "selling_price": null,
      "std_pack": "1/1"
    },
    "media": {
      "images": [],
      "documents": []
    },
    "seo": {
      "slug": "modular-changeover-switch-63a-double-pole",
      "keywords": [
        "Modular Changeover Switch",
        "Changeover",
        "63A",
        "Double Pole",
        "AUC00206300",
        "New Delhi Electricals",
        "Electrical Products"
      ],
      "meta_description": "Buy 63A Double Pole Modular Changeover Switch (AUC00206300) from New Delhi Electricals. Premium quality modular changeover for reliable power switching."
    },
    "status": {
      "is_active": true,
      "is_featured": false
    },
    "brand": "Lauritz Knudsen"
  },
  {
    "sku": "AUC00404000",
    "name": "Modular Changeover Switch 40A Four Pole",
    "product_family": "Tripper",
    "category": "Circuit Protection",
    "subcategory": "Modular Changeover Switches",
    "specs": {
      "ampere": 40,
      "poles": 4,
      "mw": 4
    },
    "variant": [],
    "pricing": {
      "mrp": 4730,
      "discount": null,
      "selling_price": null,
      "std_pack": "1/1"
    },
    "media": {
      "images": [],
      "documents": []
    },
    "seo": {
      "slug": "modular-changeover-switch-40a-four-pole",
      "keywords": [
        "Modular Changeover Switch",
        "Changeover",
        "40A",
        "Four Pole",
        "AUC00404000",
        "New Delhi Electricals",
        "Electrical Products"
      ],
      "meta_description": "Buy 40A Four Pole Modular Changeover Switch (AUC00404000) from New Delhi Electricals. Premium quality modular changeover for reliable power switching."
    },
    "status": {
      "is_active": true,
      "is_featured": false
    },
    "brand": "Lauritz Knudsen"
  },
  {
    "sku": "AUC00406300",
    "name": "Modular Changeover Switch 63A Four Pole",
    "product_family": "Tripper",
    "category": "Circuit Protection",
    "subcategory": "Modular Changeover Switches",
    "specs": {
      "ampere": 63,
      "poles": 4,
      "mw": 6
    },
    "variant": [],
    "pricing": {
      "mrp": 5365,
      "discount": null,
      "selling_price": null,
      "std_pack": "1/1"
    },
    "media": {
      "images": [],
      "documents": []
    },
    "seo": {
      "slug": "modular-changeover-switch-63a-four-pole",
      "keywords": [
        "Modular Changeover Switch",
        "Changeover",
        "63A",
        "Four Pole",
        "AUC00406300",
        "New Delhi Electricals",
        "Electrical Products"
      ],
      "meta_description": "Buy 63A Four Pole Modular Changeover Switch (AUC00406300) from New Delhi Electricals. Premium quality modular changeover for reliable power switching."
    },
    "status": {
      "is_active": true,
      "is_featured": false
    },
    "brand": "Lauritz Knudsen"
  }
]